{
  "sku": "LR-0202",
  "name": "Meridian",
  "piece_type": "ring",
  "metal": "18k_yellow_gold",
  "centre": {
    "cut": "round", "carat": 1.25, "lw": 1.0, "lab_grown": true,
    "orientation": "north_south", "setting": "bezel", "prongs": null, "bezel_wall_mm": 0.9
  },
  "composition": "solitaire",
  "band": { "profile": "cigar", "width_mm": 5.0, "taper": "taper_5_to_3", "finger_size": 7 },
  "provenance": { "source": "human", "trend_tags": ["cigar", "bezel", "round", "chunky_band"] }
}
